Heading,Url,Upload Date
What Is Data Scraping And How Can You Use It? | Target ...,https://www.targetinternet.com/what-is-data-scraping-and-how-can-you-use-it/,"Sep 13, 2017 - Uploaded by Lucy Provost"
What is Web Scraping and How Does Web Crawling Work?,https://www.scrapinghub.com/what-is-web-scraping,"May 18, 2019 - Uploaded by Scrapinghub"
What is DATA SCRAPING? What does DATA SCRAPING ...,https://www.youtube.com/watch?v=omTtMylcWOI,"Sep 21, 2017 - Uploaded by The Audiopedia"
"Data Scraping from websites into Excel | Web Scraping, Lead ...",https://www.youtube.com/watch?v=YQbe20G0ZSM,"Jan 6, 2018 - Uploaded by Video Editing & Video Marketing Services"
Web Scraping With Python - A Beginner's Guide | Edureka,https://www.edureka.co/blog/web-scraping-with-python/,"May 18, 2020 - Uploaded by edureka!"
Web Scraping Tutorial - How to Scrape Modern Websites for ...,https://www.youtube.com/watch?v=vsmxMLmroyQ,"Mar 10, 2017 - Uploaded by Fullstack Academy"
What is Web Scraping and What is it Used For? | ParseHub,https://www.parsehub.com/blog/what-is-web-scraping/,"Aug 6, 2019 - Uploaded by ParseHub"
What is data scraping? Web crawling vs web scraping Blog ...,https://oxylabs.io/blog/crawling-vs-scraping,"Jun 2, 2020 - Uploaded by Oxylabs"
Web Scraping Software - UiPath,https://www.uipath.com/solutions/technology/web-scraping-software,"Jan 31, 2015 - Uploaded by UiPath"
Web Scraping Tutorial - How to Seed your Database with Web ...,https://www.youtube.com/watch?v=_opDs6UPDyo,"Mar 10, 2017 - Uploaded by Fullstack Academy"
5 Best Web Scraping Tools in 2020! - YouTube,https://www.youtube.com/watch?v=QbkXCkcmHJI,"Apr 8, 2019 - Uploaded by Octoparse"
Understanding the Concept of Web Scraping or Data Extraction,http://houseofbots.com/news-detail/3219-1-understanding-the-concept-of-web-scraping-or-data-extraction,"Jul 9, 2018 - Uploaded by edureka!"
9 FREE Web Scrapers That You Cannot Miss in 2020 ...,https://www.octoparse.com/blog/9-free-web-scrapers-that-you-cannot-miss,"Sep 5, 2019 - Uploaded by Octoparse"
Top 30 Free Web Scraping Software in 2020 | Octoparse,https://www.octoparse.com/blog/top-30-free-web-scraping-software,"May 19, 2019 - Uploaded by Octoparse"
Web Scraping With Python | Python Tutorial | Web ... - YouTube,https://www.youtube.com/watch?v=mKxFfjNyj3c,"Dec 12, 2017 - Uploaded by edureka!"
Data Scraping and Mining From Websites Free No Coding ...,https://www.youtube.com/watch?v=CKRjXZSgg-g,"Feb 21, 2017 - Uploaded by Just2 Techno"
What is WEB SCRAPING? What does WEB SCRAPING mean ...,https://www.youtube.com/watch?v=7IUfRVYew-o,"Jan 20, 2017 - Uploaded by The Audiopedia"
Web Data Extraction Automation - UiPath,https://www.uipath.com/developers/video-tutorials/web-data-extraction-automation,"Oct 6, 2014 - Uploaded by UiPath"
Web Scraper intro tutorial - YouTube,https://www.youtube.com/watch?v=n7fob_XVsbY,"Jun 25, 2019 - Uploaded by Web Scraper"
Best Data Scraping Tools for 2020 (Top 10 Reviews) - Medium,https://medium.com/datadriveninvestor/best-data-scraping-tools-for-2019-top-10-reviews-4a686061a184,"May 6, 2019 - Uploaded by Octoparse"
Best Data Scraping Tools for 2020 (Top 10 Reviews) | Octoparse,https://www.octoparse.com/blog/best-data-scraping-tools-for-2019-top-10-reviews,"Jun 3, 2019 - Uploaded by Octoparse"
"Big Data: What Is Web Scraping, and Why Does It Matter ...",https://www.octoparse.com/blog/big-data-what-is-web-scraping-and-why-does-it-matter,"Feb 24, 2020 - Uploaded by Octoparse"
Intro to Web Scraping with Python and Beautiful Soup - YouTube,https://www.youtube.com/watch?v=XQgXKtPSzUI,"Jan 7, 2017 - Uploaded by Data Science Dojo"
ImportFromWeb | Easy Web Scraping - G Suite Marketplace,https://gsuite.google.com/marketplace/app/importfromweb_easy_web_scraping/278587576794,"Feb 5, 2020 - Uploaded by NoDataNoBusiness"
Data Scraping In UiPath Rpa Example - YouTube,https://www.youtube.com/watch?v=WtyiwEVF2-w,"May 30, 2019 - Uploaded by KB Tutorials"
Web scraping: Reliably and efficiently pull data from pages ...,https://www.youtube.com/watch?v=52wxGESwQSA,"Mar 9, 2012 - Uploaded by Next Day Video"
Data Scraping for SEO & Analytics - Tutorial - Optimize Smart,https://www.optimizesmart.com/data-scraping-guide-for-seo/,"Oct 7, 2011 - Uploaded by Garrett French CL"
QVC Can't Stop Web Scraping - Forbes,https://www.forbes.com/sites/ericgoldman/2015/03/24/qvc-cant-stop-web-scraping/,"Mar 24, 2015"
Automate Web Data Extraction and Data Scraping ...,https://www.helpsystems.com/product-lines/automate/data-scraping-extraction,"Sep 6, 2015"
Intro To Web Scraping With Python - YouTube,https://www.youtube.com/watch?v=4UcqECQe5Kc,"Jul 29, 2018 - Uploaded by Traversy Media"
What is a present-day web scraper? | Towards Data Science,https://towardsdatascience.com/what-is-a-present-day-scraper-e2c3d3b79648,"Jun 5, 2020 - Uploaded by Dmitry Narizhnykh"
UiPath Data Scraping in Hindi| Web Data Extraction in Hindi ...,https://www.youtube.com/watch?v=mip15KZKyTs,"Dec 31, 2018 - Uploaded by UiPath RPA"
20 best web scraping tools for 2020 - ScrapingBee,https://www.scrapingbee.com/blog/web-scraping-tools/,"Feb 19, 2020 - Uploaded by Web Scraper"
Web Scraping: The Comprehensive Guide for 2020 ...,https://prowebscraper.com/blog/what-is-web-scraping/,"Feb 17, 2020 - Uploaded by ProWebScraper"
Web Scraping Tool to Extract Data from Websites - Agenty,https://www.agenty.com/products/scraping-agent/,"Oct 30, 2019 - Uploaded by Agenty"
Data scraping using Uipath - YouTube,https://www.youtube.com/watch?v=yDpsq5v4UTo,"Oct 16, 2018 - Uploaded by IdeasBySupreet"
Real estate web scraping: how it is revolutionizing this ...,https://oxylabs.io/blog/data-scraping-for-real-estate,"May 11, 2020 - Uploaded by Oxylabs"
What is Web Scraping and Who is Using it? | Octoparse,https://www.octoparse.com/blog/what-is-web-scraping,"Aug 27, 2018 - Uploaded by Octoparse"
Web Scraping Examples: How are Businesses Using Web ...,https://www.parsehub.com/blog/web-scraping-examples/,"Oct 28, 2019 - Uploaded by ParseHub"
WEB SCRAPING made simple with JAVASCRIPT tutorial ...,https://www.youtube.com/watch?v=TzZ3YOUhCxo,"Jan 10, 2020 - Uploaded by Aaron Jack"
10 Myths about Web Scraping [NEW] | Octoparse,https://www.octoparse.com/blog/10-myths-about-web-scraping,"Jul 30, 2019 - Uploaded by Octoparse"
Web scraping with Python | Learn How To Scrape Data Using ...,https://www.youtube.com/watch?v=ktNAhLp0ymg,23 hours ago - Uploaded by Great Learning
Web Scraping Services - 1/3 of fortune 500 companies trust ...,https://www.mozenda.com/services/,"Mar 2, 2019"
Examples of Businesses Who Use Data Scraping | Octoparse,https://www.octoparse.com/blog/examples-of-who-use-data-scraping,"Apr 1, 2016 - Uploaded by Octoparse"
The Ultimate Web Scrapping Tutorial You'll Ever Need,https://www.digitalvidya.com/blog/web-scrapping-tutorial/,"Dec 12, 2019 - Uploaded by edureka!"
5 Reasons Why Web Scraping May Benefit Your Business ...,https://www.octoparse.com/blog/why-web-scraping-may-benefit-your-business,"Dec 17, 2019 - Uploaded by Octoparse"
Web Scraping With Google Sheets - YouTube,https://www.youtube.com/watch?v=QwK88ZujIvM,"Oct 17, 2017 - Uploaded by Ben R"
UiPath | Data Scraping from a Web Page to Excel | Tutorial ...,https://www.youtube.com/watch?v=vIAJvk4quqA,"Jan 22, 2020 - Uploaded by Anders Jensen"
How to Scrape Websites at Large Scale (2020 Guide ...,https://www.octoparse.com/blog/scrape-websites-at-large-scale,"Feb 3, 2020 - Uploaded by Octoparse"
"Automate Data Extraction – Web Scraping, Screen Scraping ...",https://www.youtube.com/watch?v=NwhG7e67sHo,"Jul 20, 2016 - Uploaded by HelpSystems"
Top 20 Web Crawling Tools to Scrape the Websites Quickly ...,https://www.octoparse.com/blog/top-20-web-crawling-tools-for-extracting-web-data,"Aug 23, 2019 - Uploaded by Octoparse"
Screen Scraping Any Desktop Application - UiPath,https://www.uipath.com/developers/video-tutorials/screen-scraping-desktop-application,"Dec 19, 2014 - Uploaded by UiPath"
Web Scraping vs API: What's the Difference? | ParseHub,https://www.parsehub.com/blog/web-scraping-vs-api/,"Mar 9, 2020 - Uploaded by ParseHub"
Scraping Data from Website to Excel (Tutorial 2020) | Octoparse,https://www.octoparse.com/blog/scraping-data-from-website-to-excel,"Feb 1, 2020 - Uploaded by Octoparse"
Screen Scraping Software - RPA | UiPath,https://www.uipath.com/solutions/technology/screen-scraping,"Dec 5, 2014 - Uploaded by UiPath"
How To Scrape Websites Using Python - randerson112358 ...,https://medium.com/@randerson112358/scrape-website-using-python-90619cac7c97,"Dec 2, 2017 - Uploaded by Computer Science"
Tidy web scraping in R — Tutorial and resources | by Keith ...,https://towardsdatascience.com/tidy-web-scraping-in-r-tutorial-and-resources-ac9f72b4fe47,"Aug 16, 2019 - Uploaded by Yrrah0015"
Web Scraping vs Data Mining: What's the Difference ...,https://www.parsehub.com/blog/web-scraping-vs-data-mining/,"Mar 2, 2020 - Uploaded by ParseHub"
15 Most Frequently Asked Questions about Web Scraping (Q&A),https://www.octoparse.com/blog/15-most-frequently-asked-questions-of-web-scraping,"Feb 1, 2019 - Uploaded by Octoparse"
Automated Web Scraping in R using rvest - YouTube,https://www.youtube.com/watch?v=NwtxrbqE2Gc,"Feb 15, 2019 - Uploaded by Data Science Dojo"
Web Scraping Python Tutorial - Web Scraping using Python ...,https://intellipaat.com/blog/tutorial/python-tutorial/python-web-scraping-tutorial/,"Jun 13, 2020 - Uploaded by Intellipaat"
Web Scraping Using Python | Python Web ... - YouTube,https://www.youtube.com/watch?v=cMFQSmEfbSE,"Dec 20, 2018 - Uploaded by Intellipaat"
Web Scraping with Python Made Easy - Towards Data Science,https://towardsdatascience.com/web-scraping-with-python-made-easy-f069ffaf7754,"Jan 28, 2020 - Uploaded by Coding Fun"
Beautiful Soup Tutorial - Web Scraping in Python - YouTube,https://www.youtube.com/watch?v=87Gx3U0BDlo,"Jan 4, 2019 - Uploaded by freeCodeCamp.org"
"Mozenda Web Scraping Software Trusted, Scalable and Fast",https://www.mozenda.com/web-scraping-software/,"Sep 9, 2015"
The Danger of Web Scraping – And How to Prevent It ...,https://www.cequence.ai/blog/the-danger-of-web-scraping-and-how-to-prevent-it/,"Jun 13, 2019"
Automated Data Scraping in Action | HelpSystems,https://www.helpsystems.com/blog/rpa-action-automated-data-scraping,"Jan 20, 2020"
Web Scraping In Python Vs R - Analytics India Magazine,https://analyticsindiamag.com/web-scraping-in-python-vs-r/,"Nov 6, 2019 - Uploaded by Analytics India Magazine"
Step-by-step Complete Guide to Web Scraping with Python,https://www.digitalvidya.com/blog/web-scraping-with-python/,"May 6, 2019 - Uploaded by Corey Schafer"
Data scraping: How to read all table content from multiple ...,https://intellipaat.com/community/42399/data-scraping-how-to-read-all-table-content-from-multiple-pages-using-next-page,"Jan 24, 2020 - Uploaded by Intellipaat"
What can Web Scraping be Used For? | ParseHub,https://www.parsehub.com/blog/web-scraping-uses/,"Feb 17, 2020 - Uploaded by ParseHub"
Automated Web Scraping in R Part 1| Writing your Script using ...,https://www.youtube.com/watch?v=smriIBG08ok,"Dec 20, 2018 - Uploaded by Data Science Dojo"
web scraping using python for beginners - YouTube,https://www.youtube.com/watch?v=0_VZ7NpVw1Y,"Feb 15, 2018 - Uploaded by Hitesh Choudhary"
How much does Web Scraping cost? | ParseHub,https://www.parsehub.com/blog/web-scraping-cost/,"Apr 6, 2020 - Uploaded by ParseHub"
Data scraping from single pages | Octoparse,https://www.octoparse.com/tutorial/single-page-web-scraping-octoparse,"Jun 23, 2016 - Uploaded by Octoparse"
What is Data Scraping | Scraping Data From the Web ...,https://teamtreehouse.com/library/what-is-data-scraping,"Aug 23, 2018"
Web Scraping Using C# - Diligent Dev - Medium,https://medium.com/@diligentdev/web-scraping-using-c-35dffe27ff1a,"Jan 26, 2020 - Uploaded by Diligent Dev"
Data Scraping 5X Faster - Mozenda,https://www.mozenda.com/data-scraping-5x-faster/,"Oct 9, 2017 - Uploaded by MozendaSupport"
Is Web Scraping Easy? How to Scrape Data without Coding ...,https://www.parsehub.com/blog/web-scraping-easy/,"Feb 10, 2020 - Uploaded by ParseHub"
Creating a horse racing Tableau dashboard from data scraping,https://www.import.io/post/data-scraping-horse-racing/,"Apr 13, 2018 - Uploaded by Craig S Dewar"
Is Web Scraping Legal? | ParseHub,https://www.parsehub.com/blog/web-scraping-legal/,"Oct 7, 2019 - Uploaded by ParseHub"
Can you Make Money from Web Scraping? Of Course ...,https://www.parsehub.com/blog/web-scraping-money/,"Mar 30, 2020 - Uploaded by ParseHub"
How to Scrape Websites Without Being Blocked? | Octoparse,https://www.octoparse.com/blog/scrape-websites-without-being-blocked,"Jul 5, 2019 - Uploaded by Octoparse"
Data Scraping is Revolutionary - Rebellion Research,https://www.rebellionresearch.com/blog/data-scraping-is-revolutionary,"Apr 10, 2020 - Uploaded by ParseHub"
Automate Web Data Scraping | HelpSystems,https://www.helpsystems.com/blog/automate-data-web-scraping,"Apr 3, 2017"
How to Generate Sales Leads Using Web Scraping | Octoparse,https://www.octoparse.com/blog/lead-generation-with-web-scraping,"Sep 27, 2019 - Uploaded by Octoparse"
Scraping the web for price comparison data (Mozenda ...,https://www.youtube.com/watch?v=goTxsjD1wTI,"Jan 6, 2019 - Uploaded by RealToughCandy"
Data scraping from details of Lists/tables in web pages ...,https://www.octoparse.com/tutorial/list-detail-page-introduction,"Mar 9, 2016 - Uploaded by Octoparse"
Web Scraping for Lead Generation | Octoparse,https://www.octoparse.com/blog/web-scraping-for-lead-generation,"Aug 29, 2017 - Uploaded by Octoparse"
Scrape The Internet To Get Training Data For Your Machine ...,https://blog.datahut.co/scrape-the-internet-to-get-training-data-for-your-machine-learning-model/,"May 26, 2017"
9 Popular Cloud-based Web Scraping Solutions - Geekflare,https://geekflare.com/web-scraping-tools/,"Feb 5, 2020 - Uploaded by Web Scraper"
Practical Introduction to Web Scraping in R - Rsquared ...,https://blog.rsquaredacademy.com/web-scraping/,"Apr 11, 2019 - Uploaded by Rsquared Academy"
How To Scrap Data from JavaScript-based Website Using ...,https://medium.com/@mahmudahsan/how-to-scrap-data-from-javascript-based-website-using-python-selenium-and-headless-web-driver-531c7fe0c01f,"Mar 8, 2020 - Uploaded by Mahmud Ahsan"
Price Scraping: How to Scrape Product Details from E ...,https://www.octoparse.com/blog/price-scraping-octoparse-free-web-scraping-software,"Feb 23, 2017 - Uploaded by Octoparse"
Web Scraping API for Data Extraction: A Beginner's Guide ...,https://www.octoparse.com/blog/web-scraping-api-for-data-extraction-a-beginners-guide,"Jan 20, 2020 - Uploaded by Octoparse"
Data Scraping Services | F6S,https://www.f6s.com/datascrapingservices,"Jan 8, 2017"
Web Scraping: How to Get Coronavirus Data (COVID-19 ...,https://www.octoparse.com/blog/get-real-time-coronavirus-data-sars-cov-2,"Feb 13, 2020 - Uploaded by Octoparse"
An Intro to Web Scraping with Python - Chi Hack Night ...,https://chihacknight.org/blog/2014/11/26/an-intro-to-web-scraping-with-python.html,"Nov 26, 2014 - Uploaded by Webucator"
3 Web Scraping Applications to Make Money | Octoparse,https://www.octoparse.com/blog/3-web-scraping-applications-to-make-money,"Sep 3, 2019 - Uploaded by HBA Services"
About Scrapinghub - The World's Leading Web Scraping ...,https://www.scrapinghub.com/about,"Nov 21, 2018"
